dataset,role,n_subjects,n_events,median_iauc_2h,median_peak_delta_2h,paper_interpretation
CGMacros,development cohort with free-living meals and MSI,40,1498,2146.3,42.6,transportability support
Stanford_CGMDB,standardized food challenge boundary,38,588,2441.318379535638,49.7574361879713,"boundary/heterogeneity evidence, not direct replication"
T1D_UOM,T1D free-living disease-state boundary,15,3820,1326.4398233333327,42.34276999999999,"boundary/heterogeneity evidence, not direct replication"
Jaeb_CGMND_HealthyAdults,external boundary,169,383117,,,"boundary/heterogeneity evidence, not direct replication"
Stanford_CGMDB_food_level,same-food challenge heterogeneity,38,588,2441.318379535638,49.75743618797131,shows substantial within-food inter-individual PPGR variability
