reactome_id,pathway_name,n_overlap,genes
R-HSA-556833,Metabolism of lipids,189,ABCA1;ABCB11;ABCC3;ABCG2;ABHD5;ACAA1;ACACA;ACACB;ACADM;ACADVL;ACBD7;ACLY;ACOT7;ACSF2;ACSL1;ACSL3;ACSL5;AGMO;AGPAT1;AGPAT4;AGT;AHR;AKR1C1;AKR1C2;AKR1C3;ALOX5;ALOX5AP;ANGPTL4;ANKRD1;ARNT2;ARSA;ARSD;ARSG;B3GALNT1;BCHE;BMAL1;CAV1;CD36;CGA;CIDEC;CREBBP;CYP11A1;CYP11B1;CYP17A1;CYP19A1;CYP1A1;CYP1B1;CYP2C19;CYP2C8;CYP2C9;CYP2D6;CYP2E1;CYP2J2;CYP3A4;CYP46A1;CYP4F11;DDHD1;DGAT1;DGAT2;DHCR24;EHHADH;ELOVL1;ELOVL5;EP300;EPHX2;FABP1;FABP3;FABP4;FABP5;FADS1;FASN;FDX1;FHL2;FITM2;G0S2;GLB1L3;GPAT2;GPD1;GPX1;GPX4
R-HSA-1280215,Cytokine Signaling in Immune system,181,ACTB;AKT1;ALOX5;ALPK1;ANXA1;ANXA2;BCL2;BECN1;BLNK;BOLA2B;CAMK2B;CANX;CASP1;CASP3;CASP8;CCL2;CCL20;CCL4;CCND1;CCR1;CCR2;CD36;CD40;CD70;CDC42;CDK1;CDKN1A;CENPX;CLCF1;CNN2;CNTFR;CSF1R;CSF2RB;CXCL1;CXCL10;CXCL8;DUSP4;DUSP6;EBI3;EDAR;EGR1;EIF2AK3;EIF4A1;FKBP5;FLNB;FOS;FOXO1;FOXO3;FURIN;GATA3;GBP2;GHR;GSDMD;GSTA2;GSTO1;HCK;HLA-B;HLA-C;HLA-DQB1;HLA-DQB2;HLA-E;HMOX1;HSPA1B;HSPA2;HSPA5;ICAM1;IFITM1;IFNA2;IFNL1;IFNL2;IFNL3;IKBIP;IKBKG;IL10RA;IL12B;IL1F10;IL1R1;IL1RAP;IL1RL2;IL20RB
R-HSA-2262752,Cellular responses to stress,175,ABCC3;ABCG2;ACADVL;AKT1;AKT1S1;ANAPC15;AR;ASNS;ATM;ATP6V1B1;ATP6V1E1;ATP6V1G1;BAG3;BCL2;BMAL1;CA9;CAMK2B;CAT;CBX2;CCL2;CCNA1;CCNA2;CCNE1;CCNE2;CDC26;CDK6;CDKN1A;CDKN2A;CDKN2B;CEBPB;CEBPG;CHAC1;COMMD3-BMI1;COX1;COX2;COX3;COX4I1;CREB3;CREB3L1;CREB3L2;CREBBP;CXCL8;CYBA;CYCS;DDIT3;DNAJB1;EDEM1;EIF2AK3;EP300;EPAS1;EPO;ERN1;ERO1A;ESR1;EZH2;FABP1;FKBP14;FKBP4;FKBP5;FOS;FOXO3;GPX1;GSK3B;GSTA1;GSTP1;H1-4;H2AJ;H2AX;H3-3A;H4C11;H4C12;H4C4;HBA2;HDAC3;HDAC6;HDGF;HIF3A;HIGD1A;HMGA2;HMOX1
R-HSA-1257604,PIP3 activates AKT signaling,65,AKT1;AKT1S1;CASP9;CBX2;CD19;CD28;CDKN1A;COMMD3-BMI1;EGFR;EGR1;ERBB3;ESR1;ESR2;EZH2;FGF1;FGF18;FGF19;FGF4;FGF7;FGF8;FGF9;FGFR1;FOXO1;FOXO3;GAB1;GSK3B;HDAC3;HDAC5;IER3;IL1RAP;IL33;INS;INSR;IRS1;LAMTOR2;MAPK1;MAPK3;MDM2;MECOM;MET;MTOR;MYD88;NR4A1;NRG2;NTRK3;PIK3CA;PIK3CG;PIK3R1;PPARG;PPP2CA;PSMA7;PSMB4;PSMD13;PSMD6;PTEN;RAC2;RBBP4;SALL4;SGK1;SNAI1;SRC;TP53;TRAF6;TRIB3;UBA52
R-HSA-9711123,Cellular response to chemical stress,60,ABCC3;ABCG2;AKT1;BCL2;CAT;CCL2;CDKN1A;CDKN2A;COX1;COX2;COX3;COX4I1;CREBBP;CYBA;CYCS;EIF2AK3;EP300;ERO1A;FABP1;GPX1;GSK3B;GSTA1;GSTP1;HBA2;HDAC3;HMOX1;HMOX2;MAP1LC3B;ME1;MED1;MYC;NCF2;NCOA1;NCOR1;NCOR2;NFE2L2;NFKB1;NLRP3;NOTCH1;NQO1;P4HB;PGD;PPARA;PRKCD;PSMA7;PSMB4;PSMD13;PSMD6;RELA;RXRA;SESN2;SLC7A11;SOD1;SOD2;SQSTM1;STAP2;TRIM21;TXN;TXNRD1;UBA52
R-HSA-1989781,PPARA activates gene expression,46,ABCA1;ACADM;ACSL1;AGT;AHR;ANGPTL4;ANKRD1;ARNT2;BMAL1;CD36;CREBBP;CYP1A1;EP300;FABP1;FADS1;FHL2;G0S2;HDAC3;HMGCR;HMGCS2;ME1;MED1;MED18;MED19;MED23;MED4;NCOA1;NCOR1;NCOR2;NPAS2;NR1H2;NR1H3;NRF1;PLIN2;PPARA;PPARG;PPARGC1A;RXRA;RXRB;SREBF1;SREBF2;TIAM2;TNFRSF21;TRIB3;TXNRD1;UGT1A9
R-HSA-400206,Regulation of lipid metabolism by PPARalpha,46,ABCA1;ACADM;ACSL1;AGT;AHR;ANGPTL4;ANKRD1;ARNT2;BMAL1;CD36;CREBBP;CYP1A1;EP300;FABP1;FADS1;FHL2;G0S2;HDAC3;HMGCR;HMGCS2;ME1;MED1;MED18;MED19;MED23;MED4;NCOA1;NCOR1;NCOR2;NPAS2;NR1H2;NR1H3;NRF1;PLIN2;PPARA;PPARG;PPARGC1A;RXRA;RXRB;SREBF1;SREBF2;TIAM2;TNFRSF21;TRIB3;TXNRD1;UGT1A9
R-HSA-381426,Regulation of Insulin-like Growth Factor (IGF) transport and uptake by Insulin-like Growth Factor Binding Proteins (IGFBPs),39,AFP;AHSG;APOL1;C3;C4A;C4B;CDH2;CHRDL1;F2;FAM20A;GOLM1;GPC3;IGF1;IGF2;IGFBP1;IGFBP3;IGFBP4;IGFBP7;IL6;KLK3;LGALS1;MMP1;MMP2;MSLN;P4HB;PAPPA2;PCSK9;PLG;PRSS23;RCN1;SERPINA10;SPP1;SPP2;STC2;TF;TIMP1;TNC;VGF;WFS1
R-HSA-1483257,Phospholipid metabolism,39,AGPAT1;AGPAT4;BCHE;DDHD1;DGAT1;DGAT2;GPAT2;GPD1;HADHA;HADHB;INPP5F;LPCAT2;LPCAT3;MBOAT1;MBOAT2;MGLL;OSBPL10;PEMT;PIK3CA;PIK3CG;PIK3R1;PLA2G12A;PLA2G15;PLA2G2A;PLA2G2E;PLA2G4A;PLA2R1;PLAAT3;PLBD1;PLD1;PLD6;PTEN;RAB4A;RUFY1;SLC44A2;SLC44A3;STARD10;SYNJ2;TNFAIP8
R-HSA-199418,Negative regulation of the PI3K/AKT network,37,AKT1;CD19;CD28;EGFR;ERBB3;ESR1;ESR2;FGF1;FGF18;FGF19;FGF4;FGF7;FGF8;FGF9;FGFR1;GAB1;IER3;IL1RAP;IL33;INS;INSR;IRS1;MAPK1;MAPK3;MET;MYD88;NRG2;NTRK3;PIK3CA;PIK3CG;PIK3R1;PPP2CA;PTEN;RAC2;SRC;TRAF6;TRIB3
R-HSA-9841922,MLL4 and MLL3 complexes regulate expression of PPARG target genes in adipogenesis and hepatic steatosis,36,ACSL1;ADIPOQ;ANGPTL4;CD36;CEBPA;CIDEC;CREBBP;DGAT2;ELOVL5;EP300;FABP4;H2AJ;H2AX;H3-3A;H4C11;H4C12;H4C4;HDAC3;LIPE;LPL;MED1;MED23;MED4;MGLL;NCOA1;NCOR1;NCOR2;PDK4;PHLDA1;PLIN2;PLIN4;PPARG;PPARGC1A;RXRA;SCD;SIRT1
R-HSA-6811558,"PI5P, PP2A and IER3 Regulate PI3K/AKT Signaling",35,AKT1;CD19;CD28;EGFR;ERBB3;ESR1;ESR2;FGF1;FGF18;FGF19;FGF4;FGF7;FGF8;FGF9;FGFR1;GAB1;IER3;IL1RAP;IL33;INS;INSR;IRS1;MAPK1;MAPK3;MET;MYD88;NRG2;NTRK3;PIK3CA;PIK3CG;PIK3R1;PPP2CA;RAC2;SRC;TRAF6
R-HSA-2219528,PI3K/AKT Signaling in Cancer,35,AKT1;AKT1S1;CASP9;CD19;CD28;CDKN1A;EGFR;ERBB3;ESR1;ESR2;FGF1;FGF18;FGF19;FGF4;FGF7;FGF8;FGF9;FGFR1;FOXO1;FOXO3;GAB1;GSK3B;IRS1;MDM2;MET;MTOR;NR4A1;NRG2;NTRK3;PIK3CA;PIK3CG;PIK3R1;PTEN;RAC2;SRC
R-HSA-1483206,Glycerophospholipid biosynthesis,30,AGPAT1;AGPAT4;BCHE;DDHD1;DGAT1;DGAT2;GPAT2;GPD1;HADHA;HADHB;LPCAT2;LPCAT3;MBOAT1;MBOAT2;MGLL;OSBPL10;PEMT;PLA2G12A;PLA2G15;PLA2G2A;PLA2G2E;PLA2G4A;PLA2R1;PLAAT3;PLBD1;PLD1;PLD6;SLC44A2;SLC44A3;STARD10
R-HSA-2559580,Oxidative Stress Induced Senescence,25,CBX2;CDK6;CDKN2A;CDKN2B;COMMD3-BMI1;EZH2;FOS;H2AJ;H2AX;H3-3A;H4C11;H4C12;H4C4;KDM6B;MAP2K6;MAP4K4;MAPK1;MAPK10;MAPK3;MAPK8;MDM2;RBBP4;TP53;TXN;UBA52
R-HSA-3371556,Cellular response to heat stress,24,AKT1S1;ATM;BAG3;CAMK2B;CREBBP;DNAJB1;EP300;FKBP4;GSK3B;HDAC6;HSPA13;HSPA1B;HSPA2;HSPA4L;HSPA5;HSPB8;HSPH1;MAPK1;MAPK3;MTOR;PTGES3;RPA1;SIRT1;YWHAE
R-HSA-2219530,Constitutive Signaling by Aberrant PI3K in Cancer,24,CD19;CD28;EGFR;ERBB3;ESR1;ESR2;FGF1;FGF18;FGF19;FGF4;FGF7;FGF8;FGF9;FGFR1;GAB1;IRS1;MET;NRG2;NTRK3;PIK3CA;PIK3CG;PIK3R1;RAC2;SRC
R-HSA-422356,Regulation of insulin secretion,23,ABCC8;ACSL3;AKAP5;CACNA1A;CACNA1C;CACNA1D;CACNA2D2;CD36;GNA14;GNG11;GNG2;GNG7;INS;ITPR2;ITPR3;KCNB1;KCNG2;PRKAR2B;PRKCA;RAP1A;RAPGEF3;SLC2A1;VAMP2
R-HSA-74752,Signaling by Insulin receptor,23,ATP6V1B1;ATP6V1E1;ATP6V1G1;CTSD;FGF1;FGF18;FGF19;FGF4;FGF7;FGF8;FGF9;FGFR1;GAB1;INS;INSR;IRS1;KRAS;MAPK1;MAPK3;PDE3B;PIK3CA;PIK3R1;TRIB3
R-HSA-9860931,Response of endothelial cells to shear stress,20,AKT1;ANXA2;CAPN2;CTNNB1;FLT4;GNG11;GNG2;GNG7;IKBKG;ITGB3;MTOR;NFKB1;PIK3CA;PPP2CA;PRKAR2B;RAMP2;RELA;TLN1;VCL;YAP1
R-HSA-74751,Insulin receptor signalling cascade,19,FGF1;FGF18;FGF19;FGF4;FGF7;FGF8;FGF9;FGFR1;GAB1;INS;INSR;IRS1;KRAS;MAPK1;MAPK3;PDE3B;PIK3CA;PIK3R1;TRIB3
R-HSA-2404192,Signaling by Type 1 Insulin-like Growth Factor 1 Receptor (IGF1R),18,FGF1;FGF18;FGF19;FGF4;FGF7;FGF8;FGF9;FGFR1;GAB1;IGF1;IGF2;IRS1;IRS4;KRAS;PDE3B;PIK3CA;PIK3R1;TRIB3
R-HSA-70326,Glucose metabolism,17,ALDOA;ENO1;ENO3;FBP2;G6PC1;GAPDH;GCK;GNPDA1;HK2;PCK1;PCK2;PFKL;PFKP;PGAM1;PGK1;PKM;PPP2CA
R-HSA-1592230,Mitochondrial biogenesis,17,ACSS2;ATP6;ATP8;CHCHD6;CREBBP;CYCS;HDAC3;MED1;NCOA1;NCOR1;NRF1;PPARA;PPARGC1A;PRKAG2;RXRA;SOD2;TFAM
R-HSA-428157,Sphingolipid metabolism,16,ABCG2;ARSA;ARSD;ARSG;B3GALNT1;GLB1L3;HEXA;HEXB;SGMS2;SGPP1;SGPP2;SMPD1;SPNS2;SPTLC3;ST3GAL3;STS
R-HSA-9662851,Anti-inflammatory response favouring Leishmania parasite infection,16,CD163;CYSLTR2;FURIN;GNG11;GNG2;GNG7;HCK;IL6;ITPR2;ITPR3;LYN;MYH9;PLK2;PRKAR2B;RHBDF2;SRC
R-HSA-109704,PI3K Cascade,14,FGF1;FGF18;FGF19;FGF4;FGF7;FGF8;FGF9;FGFR1;GAB1;IRS1;PDE3B;PIK3CA;PIK3R1;TRIB3
R-HSA-9615017,"FOXO-mediated transcription of oxidative stress, metabolic and neuronal genes",14,ATXN3;CAT;FBXO32;FOXO1;FOXO3;G6PC1;GCK;IGFBP1;INS;NR3C1;PCK1;PPARGC1A;SOD2;SREBF1
R-HSA-2559586,DNA Damage/Telomere Stress Induced Senescence,14,ATM;CCNA1;CCNA2;CCNE1;CCNE2;CDKN1A;H1-4;H2AJ;H2AX;H4C11;H4C12;H4C4;HMGA2;TP53
R-HSA-2151201,Transcriptional activation of mitochondrial biogenesis,13,ACSS2;CREBBP;CYCS;HDAC3;MED1;NCOA1;NCOR1;NRF1;PPARA;PPARGC1A;RXRA;SOD2;TFAM
R-HSA-9856530,High laminar flow shear stress activates signaling by PIEZO1 and PECAM1:CDH5:KDR in endothelial cells,13,AKT1;CAPN2;CTNNB1;FLT4;GNG11;GNG2;GNG7;MTOR;PIK3CA;PRKAR2B;RAMP2;TLN1;VCL
R-HSA-9837999,Mitochondrial protein degradation,12,ATP6;COX1;COX2;COX4I1;ECH1;HMGCS2;HSPD1;LDHD;MRPL32;NADK2;STAR;TFAM
R-HSA-9664424,Cell recruitment (pro-inflammatory response),12,C3;CASP1;GSDMD;HMOX1;MEFV;NFKB1;NFKB2;NLRP3;NT5E;PSTPIP1;RELA;TXN
R-HSA-381676,Glucagon-like Peptide-1 (GLP1) regulates insulin secretion,11,AKAP5;GNG11;GNG2;GNG7;ITPR2;ITPR3;KCNB1;KCNG2;PRKAR2B;RAP1A;RAPGEF3
R-HSA-446193,"Biosynthesis of the N-glycan precursor (dolichol lipid-linked oligosaccharide, LLO) and transfer to a nascent protein",10,CMAS;DPM3;PGM3;RENBP;ST3GAL1;ST3GAL3;ST3GAL4;ST6GAL2;ST8SIA1;UAP1
R-HSA-5674400,Constitutive Signaling by AKT1 E17K in Cancer,10,AKT1;AKT1S1;CASP9;CDKN1A;FOXO1;FOXO3;GSK3B;MDM2;MTOR;NR4A1
R-HSA-622312,Inflammasomes,10,BCL2;CASP1;HMOX1;MEFV;NFKB1;NFKB2;NLRP3;PSTPIP1;RELA;TXN
R-HSA-1660662,Glycosphingolipid metabolism,10,ARSA;ARSD;ARSG;B3GALNT1;GLB1L3;HEXA;HEXB;SMPD1;ST3GAL3;STS
R-HSA-5419276,Mitochondrial translation termination,10,ATP6;ATP8;COX1;COX2;COX3;MRPL10;MRPL32;MRPL35;MRPL47;MRPL54
R-HSA-5368287,Mitochondrial translation,10,ATP6;ATP8;COX1;COX2;COX3;MRPL10;MRPL32;MRPL35;MRPL47;MRPL54
R-HSA-844456,The NLRP3 inflammasome,9,CASP1;HMOX1;MEFV;NFKB1;NFKB2;NLRP3;PSTPIP1;RELA;TXN
R-HSA-9860927,"Turbulent (oscillatory, disturbed) flow shear stress activates signaling by PIEZO1 and integrins in endothelial cells",9,ANXA2;CAPN2;IKBKG;ITGB3;NFKB1;PPP2CA;RELA;VCL;YAP1
R-HSA-1268020,Mitochondrial protein import,8,GRPEL2;HSPD1;LDHD;SLC25A12;TIMM23;TOMM20;TOMM6;VDAC1
R-HSA-9841251,Mitochondrial unfolded protein response (UPRmt),8,AKT1;CAT;ESR1;FOXO3;HSPA1B;HSPD1;NRF1;SOD2
R-HSA-9840310,Glycosphingolipid catabolism,8,ARSA;ARSD;ARSG;GLB1L3;HEXA;HEXB;SMPD1;STS
R-HSA-380994,ATF4 activates genes in response to endoplasmic reticulum  stress,7,ASNS;CCL2;CEBPB;CEBPG;CXCL8;DDIT3;IGFBP1
R-HSA-77289,Mitochondrial Fatty Acid Beta-Oxidation,7,ACADM;ACADVL;ACBD7;ACOT7;ACSF2;HADHA;HADHB
R-HSA-2029485,Role of phospholipids in phagocytosis,7,ITPR2;ITPR3;PIK3CA;PIK3R1;PLD1;PRKCD;PRKCE
R-HSA-389357,CD28 dependent PI3K/Akt signaling,7,AKT1;CD28;MTOR;PIK3CA;PIK3CG;PIK3R1;TRIB3
R-HSA-400042,"Adrenaline,noradrenaline inhibits insulin secretion",6,CACNA1C;CACNA1D;CACNA2D2;GNG11;GNG2;GNG7
R-HSA-9027276,Erythropoietin activates Phosphoinositide-3-kinase (PI3K),6,EPO;GAB1;LYN;PIK3CA;PIK3CG;PIK3R1
R-HSA-77387,Insulin receptor recycling,6,ATP6V1B1;ATP6V1E1;ATP6V1G1;CTSD;INS;INSR
R-HSA-6788467,IL-6-type cytokine receptor ligand interactions,6,CLCF1;CNTFR;IL31RA;LIF;LIFR;OSMR
R-HSA-9662834,CD163 mediating an anti-inflammatory response,6,CD163;FURIN;IL6;MYH9;PLK2;RHBDF2
R-HSA-176187,Activation of ATR in response to replication stress,6,CHEK1;MCM2;MCM4;MCM5;MCM6;RPA1
R-HSA-198323,AKT phosphorylates targets in the cytosol,6,AKT1;AKT1S1;CASP9;CDKN1A;GSK3B;MDM2
R-HSA-1963642,PI3K events in ERBB2 signaling,6,EGFR;ERBB3;GAB1;NRG2;PIK3CA;PIK3R1
R-HSA-264876,Insulin processing,5,INS;KIF5A;KIF5C;P4HB;VAMP2
R-HSA-111457,Release of apoptotic factors from the mitochondria,5,BAX;CYCS;DIABLO;GSDMD;SEPTIN4
R-HSA-111447,Activation of BAD and translocation to mitochondria ,5,AKT1;BCL2;PPP3CC;SFN;YWHAE
R-HSA-392451,G beta:gamma signalling through PI3Kgamma,5,AKT1;GNG11;GNG2;GNG7;PIK3CG
R-HSA-9660821,ADORA2B mediated anti-inflammatory cytokines production,5,GNG11;GNG2;GNG7;IL6;PRKAR2B
R-HSA-9603381,Activated NTRK3 signals through PI3K,5,IRS1;NTRK3;PIK3CA;PIK3R1;SRC
R-HSA-5368286,Mitochondrial translation initiation,5,MRPL10;MRPL32;MRPL35;MRPL47;MRPL54
R-HSA-9937383,Mitochondrial ribosome-associated quality control,5,MRPL10;MRPL32;MRPL35;MRPL47;MRPL54
R-HSA-5389840,Mitochondrial translation elongation,5,MRPL10;MRPL32;MRPL35;MRPL47;MRPL54
R-HSA-9818026,NFE2L2 regulating inflammation associated genes,4,CCL2;CREBBP;EP300;NFE2L2
R-HSA-77286,mitochondrial fatty acid beta-oxidation of saturated fatty acids,4,ACADM;ACADVL;HADHA;HADHB
R-HSA-8851907,MET activates PI3K/AKT signaling,4,GAB1;MET;PIK3CA;PIK3R1
R-HSA-198693,AKT phosphorylates targets in the nucleus,4,AKT1;FOXO1;FOXO3;NR4A1
R-HSA-3134963,DEx/H-box helicases activate type I IFN and inflammatory cytokines production ,4,MYD88;NFKB1;NFKB2;RELA
R-HSA-419408,Lysosphingolipid and LPA receptors,4,LPAR5;PLPPR4;S1PR1;S1PR5
R-HSA-1660661,Sphingolipid de novo biosynthesis,4,ABCG2;SGMS2;SPNS2;SPTLC3
R-HSA-198203,PI3K/AKT activation,4,IRS1;NGF;PIK3CA;PIK3R1
R-HSA-5660668,CLEC7A/inflammasome pathway,3,CASP8;NFKB1;RELA
R-HSA-9028335,Activated NTRK2 signals through PI3K,3,GAB1;PIK3CA;PIK3R1
R-HSA-9818035,NFE2L2 regulating ER-stress associated genes,3,CREBBP;EP300;NFE2L2
R-HSA-77288,mitochondrial fatty acid beta-oxidation of unsaturated fatty acids,3,ACADM;HADHA;HADHB
R-HSA-400511,"Synthesis, secretion, and inactivation of Glucose-dependent Insulinotropic Polypeptide (GIP)",3,GIP;ISL1;PAX6
R-HSA-390918,Peroxisomal lipid metabolism,3,ACAA1;EHHADH;HSD17B4
R-HSA-1250342,PI3K events in ERBB4 signaling,3,NRG2;PIK3CA;PIK3R1
R-HSA-139915,Activation of PUMA and translocation to mitochondria,3,BBC3;TP53;TP63
R-HSA-400451,Free fatty acids regulate insulin secretion,3,ACSL3;CD36;GNA14
R-HSA-9686114,Non-canonical inflammasome activation,3,CASP3;GBP2;GSDMD
R-HSA-8964572,Lipid particle organization,3,CIDEC;FITM2;HILPDA
R-HSA-111448,Activation of NOXA and translocation to mitochondria,2,PMAIP1;TP53
R-HSA-166187,Mitochondrial Uncoupling,2,SLC25A27;UCP1
R-HSA-399997,Acetylcholine regulates insulin secretion,2,GNA14;PRKCA
R-HSA-434313,Intracellular metabolism of fatty acids regulates insulin secretion,2,ACSL3;CD36
R-HSA-2151209,Activation of PPARGC1A (PGC-1alpha) by phosphorylation,2,PPARGC1A;PRKAG2
R-HSA-211163,AKT-mediated inactivation of FOXO1A,2,AKT1;FOXO1
R-HSA-159763,Transport of gamma-carboxylated protein precursors from the endoplasmic reticulum to the Golgi apparatus,2,F10;F2
R-HSA-139910,Activation of BMF and translocation to mitochondria,2,BMF;MAPK8
R-HSA-9840309,Glycosphingolipid biosynthesis,2,B3GALNT1;ST3GAL3
R-HSA-6793080,rRNA modification in the mitochondrion,2,MRM1;RCC1L
R-HSA-8868766,rRNA processing in the mitochondrion,2,MRM1;RCC1L
R-HSA-8849469,PTK6 Regulates RTKs and Their Effectors AKT1 and DOK1,2,AKT1;UBA52
R-HSA-9845614,Sphingolipid catabolism,2,SGPP1;SGPP2
R-HSA-9632693,Evasion of Oxidative Stress Induced Senescence Due to p16INK4A Defects,2,CDK6;CDKN2A
R-HSA-9632700,Evasion of Oxidative Stress Induced Senescence Due to Defective p16INK4A binding to CDK4 and CDK6,2,CDK6;CDKN2A
R-HSA-9675132,Diseases of cellular response to stress,2,CDK6;CDKN2A
R-HSA-1362409,Mitochondrial iron-sulfur cluster biogenesis,1,FDX1
R-HSA-379726,Mitochondrial tRNA aminoacylation,1,QARS1
R-HSA-111446,Activation of BIM and translocation to mitochondria ,1,MAPK8
R-HSA-1369062,ABC transporters in lipid homeostasis,1,ABCA9
R-HSA-165181,Inhibition of TSC complex formation by AKT (PKB),1,AKT1
R-HSA-165158,Activation of AKT2,1,TRIB3
R-HSA-163282,Mitochondrial transcription initiation,1,TFAM
R-HSA-141333,Biogenic amines are oxidatively deaminated to aldehydes by MAOA and MAOB,1,MAOB
R-HSA-428359,Insulin-like Growth Factor-2 mRNA Binding Proteins (IGF2BPs/IMPs/VICKZs) bind RNA,1,IGF2BP2
R-HSA-8949215,Mitochondrial calcium ion transport,1,VDAC1
R-HSA-844615,The AIM2 inflammasome,1,CASP1
R-HSA-844623,The IPAF inflammasome,1,CASP1
R-HSA-75944,Transcription from mitochondrial promoters,1,TFAM
R-HSA-75108,"Activation, myristolyation of BID and translocation to mitochondria",1,CASP8
R-HSA-6787450,tRNA modification in the mitochondrion,1,TRIT1
R-HSA-68884,Mitotic Telophase/Cytokinesis,1,SMC1A
R-HSA-434316,Fatty Acids bound to GPR40 (FFAR1) regulate insulin secretion,1,GNA14
R-HSA-844455,The NLRP1 inflammasome,1,BCL2
R-HSA-9646304,Evasion of Oxidative Stress Induced Senescence Due to p14ARF Defects,1,CDKN2A
R-HSA-9632697,Evasion of Oxidative Stress Induced Senescence Due to Defective p16INK4A binding to CDK4,1,CDKN2A
R-HSA-9836573,Mitochondrial RNA degradation,1,REXO2
R-HSA-9913635,Strand-asynchronous mitochondrial DNA replication,1,LIG3
R-HSA-9937008,Mitochondrial mRNA modification,1,RCC1L
R-HSA-9948001,CASP4 inflammasome assembly,1,GBP2
